{
  "$schema": "http://json-schema.org/draft-07/schema#",
  "$id": "https://github.com/berlinguyinca/autospec/blob/main/skills/autospec-shared/schemas/llm-manifest.schema.json",
  "title": "LLM Manifest",
  "description": "Per-symbol manifest for LLM-ingestible repo documentation (spec §5b)",
  "type": "object",
  "required": ["schema_version", "repo", "generated_at", "commit", "modules", "cli_entry_points", "http_endpoints", "concepts", "faq"],
  "additionalProperties": false,
  "properties": {
    "schema_version": {
      "type": "string",
      "enum": ["1.0"],
      "description": "Manifest schema version"
    },
    "repo": {
      "type": "string",
      "description": "Repository slug (owner/name)"
    },
    "generated_at": {
      "type": "string",
      "format": "date-time",
      "description": "ISO 8601 timestamp of generation"
    },
    "commit": {
      "type": "string",
      "description": "Short git commit SHA at generation time"
    },
    "modules": {
      "type": "array",
      "description": "Per-module entries derived from tree-sitter cluster output",
      "items": {
        "type": "object",
        "required": ["path", "summary", "public_api", "depends_on"],
        "additionalProperties": false,
        "properties": {
          "path": { "type": "string", "description": "Repo-root-relative path to module" },
          "summary": { "type": "string", "description": "One-line module summary" },
          "public_api": {
            "type": "array",
            "items": {
              "type": "object",
              "required": ["name", "signature"],
              "additionalProperties": true,
              "properties": {
                "name": { "type": "string" },
                "signature": { "type": "string" },
                "params": { "type": "array", "items": { "type": "string" } },
                "returns": { "type": "string" },
                "usage_example": { "type": "string" }
              }
            }
          },
          "depends_on": {
            "type": "array",
            "items": { "type": "string" },
            "description": "Paths of modules this module imports"
          },
          "spec_ref": {
            "type": "string",
            "description": "Optional link to spec section (path#anchor)"
          }
        }
      }
    },
    "cli_entry_points": {
      "type": "array",
      "items": {
        "type": "object",
        "required": ["identifier", "path", "line"],
        "additionalProperties": true,
        "properties": {
          "identifier": { "type": "string" },
          "path": { "type": "string" },
          "line": { "type": "integer" }
        }
      }
    },
    "http_endpoints": {
      "type": "array",
      "items": {
        "type": "object",
        "required": ["route", "path", "line"],
        "additionalProperties": true,
        "properties": {
          "route": { "type": "string" },
          "path": { "type": "string" },
          "line": { "type": "integer" }
        }
      }
    },
    "concepts": {
      "type": "array",
      "items": {
        "type": "object",
        "required": ["name", "definition"],
        "additionalProperties": true,
        "properties": {
          "name": { "type": "string" },
          "definition": { "type": "string" },
          "source_anchor": { "type": "string" }
        }
      }
    },
    "faq": {
      "type": "array",
      "items": {
        "type": "object",
        "required": ["q", "a", "needs_review"],
        "additionalProperties": false,
        "properties": {
          "q": { "type": "string" },
          "a": { "type": "string" },
          "needs_review": { "type": "boolean" }
        }
      }
    }
  }
}
